Date;Rue;Latitude;Longitude;Vitesse;Etat;Distance;Infos
06/11/23 05:58:54;Avenue du Général Leclerc, Saint-Martin-le-Vinoux;45.214115;5.697998;;ALERTE;174;NC - Mauvais tri
06/11/23 07:19:15;Rue Pierre Semard, Saint-Martin-le-Vinoux;45.212578;5.698439;;ALERTE;519;NC - Mauvais tri
06/11/23 07:23:23;Rue Félix Faure, Saint-Martin-le-Vinoux;45.215527;5.693316;;ALERTE;109;NC - Mauvais tri
06/11/23 07:32:39;Rue Jean Moulin, Saint-Martin-le-Vinoux;45.214985;5.69447;;ALERTE;48;NC - Mauvais tri
06/11/23 07:33:39;Rue Jean Moulin, Saint-Martin-le-Vinoux;45.214817;5.695031;;ALERTE;0;NC - Mauvais tri
